tissue_dissectioning_input_entity_label,d906ee29-f041-4642-8ba2-c1a54af213ea,tissue_dissectioning_input_entity_label,,A label of a primary input entity of a tissue dissectioning process.,Specification of the set of brain sections to be used in a dissectioning process to obtain a tissue sample in a region of interest.,,,,,string,1,2023-05-24,,,,,,,
tissue_dissectioning_input_process_id,9cfb3a49-ac05-4ce5-8ed9-c9d82d6ff761,tissue_dissectioning_input_process_id,,An identifier of an associated tissue dissectioning process.,,,,,,string,1,2023-05-24,,,,,,,
brain_section_label,e3bd9517-80e1-4158-981d-bb73baabceca,brain_section_label,,A label that refers to a brain section.,"A flat piece of brain tissue obtained from slicing a brain segment with blade. When multiple brain sections are obtain from the slicing process, an ordinal is assigned to provide information about the relative positioning of the sections.",,,,,string,1,2023-05-24,,,,,,,
brain_section_created_by_process_id,a6e62b20-8c2d-4e40-a03b-41d943ec11cb,brain_section_created_by_process_id,,An identifier of a process that created a brain section.,,,,,,string,1,2023-05-24,,,,,,,
brain_section_ordinal,d97be176-d39e-413c-8c1f-14e47f23da66,brain_section_ordinal,,A sequential number of a section used to track the relative positional order of sections from a segment.,The sequential number of the section used to keep track of the relative positional order of sections from a segment,,,,,integer,1,2023-05-24,,,,,,,
brain_segment_sectioning_input_entity_label,e41e854d-b68a-4c69-b23f-d1d39891dff0,brain_segment_sectioning_input_entity_label,,A label of a primary input of a brain segment sectioning process.,,,,,,string,1,2023-05-24,,,,,,,
brain_segment_sectioning_process_id,3d426c44-47b2-4329-a06a-addd323bbf46,brain_segment_sectioning_process_id,,An identifier of a brain segment sectioning process.,"The process of slicing a brain segment into flat pieces of specific thickness using a blade. Typically, multiple brain sections are obtain in the sectioning process per brain_segment.",,,,,,1,2023-05-24,,,,,,,
brain_segment_label,befeefc1-4be3-4974-a54e-929fd83cbf28,brain_segment_label,,A label that refers to a brain segment.,A physical piece of tissue subdivided from a donor brain. The segment may be used in directly in a study or further subdivided into smaller segment or sectioned.,,,,,string,1,2023-05-24,,,,,,,
brain_segment_created_by_process_id,03856361-d1b5-4983-a0fb-ae5a75d8ec6e,brain_segment_created_by_process_id,,An identifier of a process that created a brain segment.,,,,,,string,1,2023-05-24,,,,,,,
brain_segment_anatomical_division,ec2565cc-1a11-4d1d-9c98-7eeeca27fd82,brain_segment_anatomical_division,,"The anatomical division that describes the brain segment; for example, whole brain, cerebrum, cerebellum, brainstem.",,,,,,string,1,2023-05-24,,,,,,,
brain_segment_barcode,516560ed-0715-475a-b717-6ccfa3ec2934,brain_segment_barcode,,A ohysical barcode label for a vessel holding a brain segment.,Physical barcode label for vessel holding brain_segment,,,,,string,1,2023-05-24,,,,,,,
brain_extraction_input_entity_label,29442943-7d3d-4126-8817-9c10e34c8b83,brain_extraction_input_entity_label,,A label of a primary input of a brain extraction process.,The label of the donor.,,,,,string,1,2023-05-24,,,,,,,
brain_extraction_outpute_entity_label,583a312a-43de-4c00-91ad-ec65f6fed2df,brain_extraction_outpute_entity_label,,A label of a primary output of a brain extraction process.,The label of the brain_segment.,,,,,string,1,2023-05-24,,,,,,,
brain_extraction_process_id,d1549808-92c8-4cf8-8e88-ad98a123d645,brain_extraction_process_id,,An identifier of a brain extraction process.,The identifier of this brain extraction process (allowing the brain to then be further subdivided for processing).,,,,,string,1,2023-05-24,,,,,,,
donor_label,cb8ebdda-c8d2-4c29-b6cd-fcb5d0d6e720,donor_label,,A label that refers to a donor.,An organism providing one or more samples for scientific study (aka donor name),,,,,string,1,2023-05-24,,,,,,,
donor_age_at_death,3df398ff-c5ee-4754-aeb8-2dd86027622e,donor_age_at_death,,The age of a donor at the time of death.,,,,,,string,1,2023-05-24,,,,,,,
donor_date_of_birth,4c376dcd-cf1f-4ccb-9d93-28ca73f53019,donor_date_of_birth,,The date of birth of a donor.,,,,,,datetime,1,2023-05-24,,,,,,,
donor_date_of_death,4cbe0de6-0d4d-4a7d-b38b-c483deaa0e3a,donor_date_of_death,,The date of death of a donor.,,,,,,datetime,1,2023-05-24,,,,,,,
donor_full_genotype,0a4c3a68-b41f-47e6-8128-257abc2ccaa5,donor_full_genotype,,The full genotype of a donor.,,,,,,string,1,2023-05-24,,,,,,,
donor_ncbitaxonomyid,6837cb02-6bd7-4fb8-838c-9062ead96ba4,donor_ncbitaxonomyid,,The NCBI taxonomy identifier of the organism type of this donor.,,,,,,string,1,2023-05-24,,,,,,,
donor_sex,632d3d3f-f85b-4efc-a1ab-010fe417ae81,donor_sex,,"The sex of this donor organism; for example, M or F.",,,,,,categorical,1,2023-05-24,,,,,,,
age_label,0630a265-4a63-48f4-8853-66b929002306,age_label,,A label that refers to an age.,identifier,,,,,string,1,2023-05-24,,,,,,,
age_reference_point,3bed1f94-9d82-4ed7-afdf-79d896b24dbb,age_reference_point,,"The reference point for an age interval; for example, birth or conception.",,,,,,string,1,2023-05-24,,,,,,,
age_unit,b5436e99-f0a7-4c30-825d-56b88ee2ac1d,age_unit,,The unit used for representing the donor age from the reference point.,(eg days or years - controlled vocabulary?),,,hours/days/weeks/months/years,,categorical,1,2023-05-24,,,,,,,
age_value,57e24d3c-c9c7-4ef3-9809-a35802d563ec,age_value,,The value representing the donor age from the reference point.,,,,,,string,1,2023-05-24,,,,,,,